{
  "contributor": "SLS maintainers",
  "reviewers": [
    "maintainer review (native speaker)"
  ],
  "source": "Somali Language Standard curated evidence library",
  "date_added": "2026-08-31",
  "review_status": "reviewed",
  "license": "CC BY 4.0",
  "schema_version": "1.0.0",
  "since_version": "0.3.0"
}
